author,title,description,tags,location
Ahmed,Working on Symphony,My life is pure torture.,#coding #code #symphony,100 Bogart Street
Joseph,Marrying PHP,I hate Node.js and PHP is the best thing ever.,#php #js #symphony,Home
Reggie Fils-Aime,Fortnite,I cant wait to drop off the Battle Bus and meet some of you on the battlefield in Fortnite.,#fortnite #gaming #gamer,Nintendo Switch
Pogchamp,Poggers?,Can I get pog in chat?,#gamer #gaming #pog,twitch.tv
Kanye West,Campaign 2020 Kickoff,No one man should have all that power...except me,#2020 #president ,"New York, NY"
Leon Maksin,Rocketry Meeting,Were going to space...,#rocketry #stuyvesant #club,room 427
dudeson,Whats popping...?,Take my hoodie off no keep it on its cute af...,#whatspopping,1600 Pennsylvania Ave
son qbert,Minecraft Fridays,Pull up.,#gamer #minecraft,beanlanding.ddns.net
DanTDM,Tea at Some Kids House,Would you like to come to my house?,#gamer #minecraft,house